{
  "$schema": "https://json-schema.org/draft/2020-12/schema",
  "$id": "urn:vaultvoice:model-catalog:v1",
  "title": "VaultVoice model catalog, schema 1 (MDL-01)",
  "description": "Normative rules are enforced by tools/model-catalog/catalog.py (validate_catalog) and app/lib/features/models/domain/model_catalog.dart; this file documents them. Extra rules not expressible here: model ids are unique, companions reference other ids in the same catalog, the signature (catalog.json.sig) covers the exact file bytes, file is at most 1 MiB.",
  "type": "object",
  "required": ["schema", "issued_at", "min_app_version", "models"],
  "properties": {
    "schema": { "const": 1 },
    "issued_at": {
      "description": "UTC issue time. The app rejects a catalog older than the bundled or last accepted one (rollback protection).",
      "type": "string",
      "pattern": "^\\d{4}-\\d{2}-\\d{2}T\\d{2}:\\d{2}:\\d{2}Z$"
    },
    "min_app_version": { "$ref": "#/$defs/semver" },
    "models": { "type": "array", "minItems": 1, "items": { "$ref": "#/$defs/model" } }
  },
  "$defs": {
    "semver": { "type": "string", "pattern": "^(0|[1-9]\\d*)\\.(0|[1-9]\\d*)\\.(0|[1-9]\\d*)$" },
    "httpsUrl": {
      "description": "https only; no credentials, port, query or fragment (no identifiers in requests).",
      "type": "string",
      "pattern": "^https://[^/?#@:]+(/[^?#]*)?$"
    },
    "model": {
      "type": "object",
      "required": ["id", "type", "version", "display_name", "tier", "file", "size", "sha256",
                   "min_ram_mb", "recommended_device_tiers", "license", "license_url",
                   "attribution", "urls", "companions"],
      "properties": {
        "id": { "type": "string", "pattern": "^[a-z0-9][a-z0-9._-]{0,63}$" },
        "type": { "enum": ["stt", "llm", "vad", "diarization-seg", "diarization-emb", "coreml-encoder"] },
        "version": { "type": "string", "minLength": 1 },
        "display_name": { "type": "string", "minLength": 1 },
        "tier": { "enum": ["free", "pro", "enterprise"] },
        "file": {
          "description": "Plain file name (no path separators): the install path is models/<id>/<file>.",
          "type": "string",
          "pattern": "^[A-Za-z0-9][A-Za-z0-9._-]{0,127}$"
        },
        "size": { "type": "integer", "minimum": 1 },
        "sha256": { "type": "string", "pattern": "^[0-9a-f]{64}$" },
        "min_ram_mb": { "type": "integer", "minimum": 0 },
        "recommended_device_tiers": {
          "type": "array", "minItems": 1, "uniqueItems": true,
          "items": { "enum": ["low", "mid", "high"] }
        },
        "license": { "type": "string", "minLength": 1 },
        "license_url": { "$ref": "#/$defs/httpsUrl" },
        "attribution": { "type": ["string", "null"], "minLength": 1 },
        "min_app_version": { "$ref": "#/$defs/semver" },
        "urls": {
          "description": "Primary first, then mirrors. Every host must be on the app's NetworkGateway allowlist.",
          "type": "array", "minItems": 1, "uniqueItems": true,
          "items": { "$ref": "#/$defs/httpsUrl" }
        },
        "companions": { "type": "array", "items": { "type": "string" } }
      }
    }
  }
}
